año;título;descripción;localización;fecha inicio;fecha fin;duracion;tipo ayuda;vía canalización;odm;meta odm;tipo beneficiarios;numero beneficiarios;mujeres beneficiadas;resultado;región;área;renta;tema;importe comprometido;importe abonado;tipo organismo;organismo;agencia;número intervención;código interno
2007;PROYECTO DE AGUA Y SANEAMIENTO EN SIETE DEPARTAMENTOS DE HONDURAS;FORTALECIMIENTO DE LAS CAPACIDADES INSTITUCIONALES Y COMUNITARIAS PARA LA GESTIÓN DE SISTEMAS DE AGUA SEGURA Y SANEAMIENTO, Y LA  PROMOCIÓN DE BUENAS PRÁCTICAS DE HIGIENE;DEPARTAMENTOS DE INTIBUCÁ, YORO, LEMPIRA, SANTA BÁRBARA, OCOTEPEQUE, COLÓN Y EL PARAÍSO - SAN MARCOS DE SIERRAYORITO, LEPAERA, CEGUACA, SANTA FÉ, CONCEPCIÓN, BONITO ORIENTAL, TEUPASENTI;39.083;Sin datos ese año;1;;Bilateral;Sin datos ese año;Sin datos ese año;ND;Sin datos ese año;Sin datos ese año;8 MUNICIPALIDADES CUENTAN CON DIAGNÓSTICOS Y PLANES DE ACCIÓN EN AGUA Y SANEAMIENTO;HONDURAS;AMECEN;PRMB;14030;299.000;299.000;Comunidades Autónomas;CCAA AND - Andalucía;CCAA AND AACI - Andalucía - Agencia Andaluza de Cooperación Internacional;07-BBB-02966;Sin datos ese año
2007;CONSTRUCCIÓN DE UN SISTEMA DE ALCANTARILLADO Y PLANTA DE TRATAMIENTO EN CANTIDAD Y CALIDAD ADECUADA PARA EL MUNICIPIO DE SAN IGNACIO (2ª FASE);MEJORA DE LA CALIDAD DE VIDA DE LA POBLACIÓN DEL MUNICIPIO DE SAN IGNACIO MEDIANTE LA CONSTRUCCIÓN DE UN SISTEMA DE ALCANTARILLADO Y PLANTA DE TRATAMIENTO EN CANTIDAD Y CALIDAD ADECUADA  PARA ESTA POBLACIÓN;DEPARTAMENTO DE FRANCISCO MORAZÁN - MUNICIPIO DE SAN IGNACIO;39.083;Sin datos ese año;1;;Bilateral;Sin datos ese año;Sin datos ese año;ND;Sin datos ese año;Sin datos ese año;SE HABRÁ DOTADO DE UN SISTEMA DE ALCANTARILLADO A 1460 HABITANTES DEL MUNICIPIO DE SAN IGNACIO;HONDURAS;AMECEN;PRMB;14030;257.789;257.789;Comunidades Autónomas;CCAA AND - Andalucía;CCAA AND AACI - Andalucía - Agencia Andaluza de Cooperación Internacional;07-BBB-02968;Sin datos ese año
2007;SISTEMAS DE AGUA POTABLE Y EDUCACIÓN PARA LA SALUD (SIAPEPS) EN LA MANCOMUNIDAD SUROESTE DE LEMPIRA;MEJORA DEL ACCESO A LOS SERVICIOS DE AGUA Y SANEAMIENTO, EN TÉRMINOS DE CANTIDAD, CALIDAD Y CONTINUIDAD, DE LOS HABITANTES DE LAS COMUNIDADES DE OLOSINGO, TERLACA Y EL PINAL , EN EL MUNICIPIO DE GUARITA, LEMPIRA;LEMPIRA - MUNICIPIO DE GUARPA, COMUNIDADES DE TERCAL, OLOSINGO Y PINILLA;39.083;Sin datos ese año;1;;Bilateral;Sin datos ese año;Sin datos ese año;DIRECTOS: COMUNIDADES DE TERCAL, OLOSINGO Y PINILLA;Sin datos ese año;Sin datos ese año;CONSTRUIDOS 3 SISTEMAS DE AGUA QUE SUMINISTREN AGUA EN CALIDAD Y CANTIDAD ADECUADA, 371 LETRINAS LAVABLES, 371 PILAS FAMILIARES Y CAPACITACIÓN A CADA FAMILIA DEL PROYETO, PARA CONTRIBUIR A MJORAR LAS CONDICIONES DE SALUD DE LA POBLACIÓN PARTICIPANTE;HONDURAS;AMECEN;PRMB;14030;192.852;192.852;Comunidades Autónomas;CCAA AND - Andalucía;CCAA AND AACI - Andalucía - Agencia Andaluza de Cooperación Internacional;07-BBB-02978;Sin datos ese año
2007;MEJORA DE LAS CONDICIONES DE SANEAMIENTO EN CINCO BARRIOS DEL MUNICIPIO DE GUERRA;MEJORAR LAS CONDICIONES DE SANEAMIENTO  Y DRENAJE DE AGUAS EN LOS BARRIOS DE MARCOS DEL ROSARIO, LA CANCHA, JOSÉ FRANCISCO PEÑA GÓMEZ, RAMÓN MATÍAS MELLA Y SAN JOSÉ, DE LA POBLACIÓN DE GUERRA, REPÚBLICA DOMINICANA;PROVINCIA DE SANTO DOMINGO - GUERRA;39.083;Sin datos ese año;1;;Bilateral;Sin datos ese año;Sin datos ese año;POBLACIÓN RURAL DE PROVINCIAS DE ALTO ÍNDICE DE POBREZA;Sin datos ese año;Sin datos ese año;COMITÉS DE DESARROLLO BARRIALES CONSTITUIDOS Y FORTALECIDOS;DOMINICANA, REP.;AMECEN;PRMB;14030;124.095;124.095;Comunidades Autónomas;CCAA AND - Andalucía;CCAA AND AACI - Andalucía - Agencia Andaluza de Cooperación Internacional;07-BBB-02987;Sin datos ese año
2007;ESTUDIO DE VIABILIDAD PARA LA CREACIÓN DE UN PUERTO TERRESTRE EN GUATEMALA;ELABORACION DE PLAN ESTRATEGICO PARA LA CONSTRUCCION DE UN CENTRO LOGISTICO DE GESTION DE MERCANCIAS;ND;39.083;Sin datos ese año;1;;Bilateral;Sin datos ese año;Sin datos ese año;ND;Sin datos ese año;Sin datos ese año;ND;EL SALVADOR;AMECEN;PRMB;14030;321.750;160.875;Comunidades Autónomas;CCAA AND - Andalucía;CCAA AND AACI - Andalucía - Agencia Andaluza de Cooperación Internacional;07-BBB-03050;Sin datos ese año
2007;CREACIÓN DE PLATAFORMA FINANCIERA EN EL SECTOR DE AHORRO Y CRÉDITO CENTROAMERICANO;CEPES-ANDALUCÍA, A TRAVÉS DE LA FUNDACIÓN ESCUELA ANDALUZA DE CONOMÍA SOCIAL, EN EL ÁMBITO DE SU ESTRATEGIA DE COOPERACIÓN EN LA ZONA CENTROAMERICANA Y JUNTO CON LA APRECIACIÓN DE LAS ORGANIZACIONES QUE ENGLOBAN EL CORPORATIVISMO DE CREDITO CENTROAMERICAN;ND;39.083;Sin datos ese año;1;;Bilateral;Sin datos ese año;Sin datos ese año;FEDEAC, FEDECACES, FACACH, CARUNA, FENACOAC;Sin datos ese año;Sin datos ese año;PLAN ESTRATÉGICO DEL SECTOR DE AHORRO Y CRÉDITO EN CENTROAMERICANA;AMÉRICA DEL NORTE, CENTRAL Y CARIBE, NO ESPECIFICADOS;AMECEN;NE;24010;120.000;120.000;Comunidades Autónomas;CCAA AND - Andalucía;CCAA AND AACI - Andalucía - Agencia Andaluza de Cooperación Internacional;07-BBB-02861;Sin datos ese año
2007;FOMENTO DE LA CULTURA DE LA CALIDAD Y PUESTA EN VALOR DE PROYECTO PILOTO DE IMPLANTACIÓN DE LA GESTIÓN DE LA CALIDAD EN PROCESOS Y PRODUCTOS;EN EL AMBITO DE LOS PROYECTOS Y ACTUACIONES, QUE DESDE CEPES- ANDALUCÍA Y FUNDACIÓN ESCUELA ANDALUZA DE E. SOCIAL LLEVAN A CABO EN CENTROAMÉRICA A TRAVÉS DE LA OFICINA PARA LATINOAMÉRICA EN COSTA RICA Y DESDE EL ÁMBITO ESENCIALMENTE EMPRESARIAL, Y LA OPTI;ND;39.083;Sin datos ese año;1;;Bilateral;Sin datos ese año;Sin datos ese año;ORG. DE ECONOMÍA SOCIAL, SECTORES DE ACTIVIDAD, EMP. DE E.SOCIAL EN EL ÁMBITO CENTROAMERICANO;Sin datos ese año;Sin datos ese año;PROYECTO PILOTO DE IMPLANTACIÓN DE LA GESTIÓN DE LA CALIDAD Y SU CERTIFICACIÓN EN LA ISO 9001, EN RPCESO Y PRODUCTOS;AMÉRICA DEL NORTE, CENTRAL Y CARIBE, NO ESPECIFICADOS;AMECEN;NE;32140;200.000;200.000;Comunidades Autónomas;CCAA AND - Andalucía;CCAA AND AACI - Andalucía - Agencia Andaluza de Cooperación Internacional;07-BBB-02862;Sin datos ese año
2007;PLANIFICACIÓN ESTRATÉGICA, INSTRUMENTO DE COMPETITIVIDAD EMPRESARIAL EN EL SECTOR DE LA ECONOMÍA SOCIAL CENTROAMERICANA;"EL OBJETO FUNDAMENTAL DE ESTE PROYECTO ES ""DESARROLLAR ENTRE EMPRESAS DE ECONOMÍA SOCIAL LA CULTURA Y EL LIDERAZDO DE EXCELENCIA EMPRESARIAL QUE INSPIRE LA IMPLANTACIÓN DE UN SISTEMA DE GESTIÓN ESTRATÉGICA DEL CONOCIMIENTO APROPIADO PARA DISEÑAR SU FUTURO""";ND;39.083;Sin datos ese año;1;;Bilateral;Sin datos ese año;Sin datos ese año;ORGANIZAC. DE ECONOMÍA SOCIAL CENTROAMERICANA, SECTORES DE ACTIVIDAD DE E. S. CENTROAMERICANA Y COOP;Sin datos ese año;Sin datos ese año;PROYECTO PILOTO DE EXCELENCIA EMPRESARIAL EN CENTROAMÉRICA;AMÉRICA DEL NORTE, CENTRAL Y CARIBE, NO ESPECIFICADOS;AMECEN;NE;32120;150.000;150.000;Comunidades Autónomas;CCAA AND - Andalucía;CCAA AND AACI - Andalucía - Agencia Andaluza de Cooperación Internacional;07-BBB-02864;Sin datos ese año
2007;FORMACIÓN DE PROFESIONALES DE COOPERATIVAS DE AHORRO Y CRÉDITO;FORMACIÓN DE PROFESIONALES DE COOPERATIVAS DE AHORRO Y CRÉDITO;ND;39.083;Sin datos ese año;1;;Bilateral;Sin datos ese año;Sin datos ese año;ND;Sin datos ese año;Sin datos ese año;ND;AMÉRICA DEL NORTE, CENTRAL Y CARIBE, NO ESPECIFICADOS;AMECEN;NE;24081;95.000;95.000;Comunidades Autónomas;CCAA AND - Andalucía;CCAA AND AACI - Andalucía - Agencia Andaluza de Cooperación Internacional;07-BBB-02865;Sin datos ese año
2007;FORTALECIMIENTO DE LA COMPETITIVIDAD DE LA PYME TURÍSTICA EN EL SALVADOR;APOYO A LA ORGANIZACIÓN GREMIAL DE LA PEQUEÑA Y MEDIANA EMPRESA TURISTICA A LA MEJORA DE SU OFERTA Y DE SUS SERVICIOS;ND;39.083;Sin datos ese año;1;;Bilateral;Sin datos ese año;Sin datos ese año;ND;Sin datos ese año;Sin datos ese año;ND;HONDURAS;AMECEN;PRMB;32130;321.750;160.875;Comunidades Autónomas;CCAA AND - Andalucía;CCAA AND AACI - Andalucía - Agencia Andaluza de Cooperación Internacional;07-BBB-03051;Sin datos ese año
2007;FORTALECIMIENTO AL PROCESO DE SOSTENIBILIDAD DEL CENTRO DE ACOPIO MUNICIPAL DE LA PLAYA DE EL CUCO.;ESTE PROYECTO VIENE A DAR CONTINUIDAD A LA INTERVENCIÓN SOBRE EL SUBSECTOR PESQUERO ARTESANAL EN LA REGIÓN INICIADA EN EL AÑO 2001 Y FINALIZADA EN EL AÑO 2006 CON LOS PROYCTOS DE APOYO A LOS PESCADORES ARTESANALES DE LA PLAYA DE EL CUCO, EN EL QUE SE ESTA;ND;39.083;Sin datos ese año;1;;Bilateral;Sin datos ese año;Sin datos ese año;ND;Sin datos ese año;Sin datos ese año;MEJORADA LA CAPACIDAD DE ACOPIO, PROCESAMIENTO, MANIPULACIÓN Y VENTA DE SERVICIOS DEL CENTRO DE ACOPIO PESQUERO MUNICIPAL DE LA PLAYA DE EL CUCO;EL SALVADOR;AMECEN;PRMB;31381;83.350;83.350;Comunidades Autónomas;CCAA AND - Andalucía;CCAA AND AACI - Andalucía - Agencia Andaluza de Cooperación Internacional;07-BBB-02848;Sin datos ese año
2007;PROGRAMA DE APOYO A LOS PESCADORES ARTESANALES DEL CORREGIMIENTO DEL RÍO HATO. FASE II.;PROGRAMA DE APOYO A LOS PESCADORES ARTESANALES DEL CORREGIMIENTO DEL RÍO HATO. FASE II.;ND;39.083;Sin datos ese año;1;;Bilateral;Sin datos ese año;Sin datos ese año;ND;Sin datos ese año;Sin datos ese año;REALIZADA LA URBANIZACIÓN Y DESARROLLADOS LOS ACCESOS DEL MERCADO DE MARISCOS DE COCLÉ EN FUNCIÓN DE LA PLANIFICACIÓN DE USOS Y APROVECHAMIENTO DEL SUELO REALIZADA EN EL TERRENO ADQUIRIDO POR EL GOBIERNO DE PANAMÁ;PANAMÁ;AMECEN;PRMA;31391;300.000;300.000;Comunidades Autónomas;CCAA AND - Andalucía;CCAA AND AACI - Andalucía - Agencia Andaluza de Cooperación Internacional;07-BBB-02853;Sin datos ese año
2007;FORTALECIMIENTO DE LAS CAPACIDADES PARA LA GESTIÓN SOSTENIBLE DEL DESARROLLO DE LA SUBCUENCA VIRUNDO PAMPAHUASI;EL PROYECTO PRETENDE CONTRIBUIR AL DESARROLLO RURAL SUSTENTABLE DE LA MARGEN IZQUIERDA DE LA SUBCUENCA DE VIRUNDO PAMPAHUASI. SE TRABAJARÁ EN CINCO LÍNEAS: GESTIÓN SOCIAL DE AGUA EN FORMA EFICIENTE MEDIANTE MANEJO DE SISTEMAS DE RIEGO PARA INCREMENTAR SU ;PROVINCIA DE GRAU, REGIÓN APURIMAC - PATAYPAMPA, SANTA ROSA Y VIRUNDO;39.083;Sin datos ese año;1;;Bilateral;Sin datos ese año;Sin datos ese año;ND;Sin datos ese año;Sin datos ese año;ORGANIZACIONES Y FAMILIAS DE LA SUBCUENCA CON CAPACIDADES FORTALECIDAS REALIZAN GESTIÓN SOCIAL DEL AGUA EN FORMA EFICIENTE MEDIANTE MANEJO DEL SISTEMA DE RIEGO, INCREMENTANDO SU PRODUCCIÓN AGROPECUARIA;PERÚ;AMESUR;PRMB;31140;300.000;300.000;Comunidades Autónomas;CCAA AND - Andalucía;CCAA AND AACI - Andalucía - Agencia Andaluza de Cooperación Internacional;07-BBB-02929;Sin datos ese año
2007;MUROS DE CONTENCIÓN Y RECUPERACIÓN DE TIERRAS DE CULTIVO, FASE 4;PROTECCIÓN DE LOS TERRENOS DE CULTIVO DE LA ACCIÓN EROSIVA DEL RÍO CON MUROS DE CONTENCIÓN, AMPLIANDO LA SUPERFICIE DE LOS MISMOS Y CONSOLIDANDO TIERRAS DEVASTADAS ANTERIORMENTE POR EL RÍO;COCHABAMBA, QUILLACOLLO - SIPE SIPE;39.083;Sin datos ese año;1;;Bilateral;Sin datos ese año;Sin datos ese año;ND;Sin datos ese año;Sin datos ese año;SE HAN CONSTRUIDO 2400 MTS. LINEALES DE MURO NUEVO QUE CONTIENEN EL AGUA DEL RÍO Y DEFIENDEN LOS TERRENOS DE CULTIVO;BOLIVIA;AMESUR;PRMB;31140;210.797;210.797;Comunidades Autónomas;CCAA AND - Andalucía;CCAA AND AACI - Andalucía - Agencia Andaluza de Cooperación Internacional;07-BBB-02956;Sin datos ese año
2007;PROGRAMA DE DESARROLLO DE LA COMUNIDAD DE FARALLÓN.;LA INTERVENCIÓN VIENE A DAR CONTINUIDAD A UNA INTERVENCIÓN INCIADA POR LA JUNTA DE ANDALUCÍA EN EL CORREGIMIENTO DE RÍO HATO CON LA CONTRUCCIÓN DE UN MERCADO DE MARISCOS COMO APOYO AL SUBSECTOR PESQUERO ARTESANAL, Y SE DESARROLLA SOBRE LOS SIGUIENTES EJES;ND;39.083;Sin datos ese año;1;;Bilateral;Sin datos ese año;Sin datos ese año;ND;Sin datos ese año;Sin datos ese año;MEJORADO EL ACCESO A VIVIENDA, SERVICIOS BÁSICOS Y EQUIPAMIENTO SOCIAL PARA LAS FAMILIAS DE LA POBLACIÓN DE FARALLÓN;PANAMÁ;AMECEN;PRMA;31320;1.400.000;1.400.000;Comunidades Autónomas;CCAA AND - Andalucía;CCAA AND AACI - Andalucía - Agencia Andaluza de Cooperación Internacional;07-BBB-02851;Sin datos ese año
2007;CREACIÓN DE UNA BIBLIOTECA PÚBLICA EN NADOR, MARRUECOS.- FASE III ;CREACIÓN DE UNA BIBLIOTECA PÚBLICA EN NADOR, MARRUECOS.- FASE III ;NADOR;39.083;Sin datos ese año;1;;Bilateral;Sin datos ese año;Sin datos ese año;ND;Sin datos ese año;Sin datos ese año;Construcción de la biblioteca pública;MARRUECOS;AFRNOR;PRMB;16061;444.148;444.148;Comunidades Autónomas;CCAA AND - Andalucía;CCAA AND AACI - Andalucía - Agencia Andaluza de Cooperación Internacional;07-BBB-02835;Sin datos ese año
2007;APOYO A LA CONSERVACIÓN, ORGANIZACIÓN Y DIFUSIÓN DEL FONDO KATI DE TOMBUCTÚ, MALI ;APOYO A LA CONSERVACIÓN, ORGANIZACIÓN Y DIFUSIÓN DEL FONDO KATI DE TOMBUCTÚ, MALI ;ND;39.083;Sin datos ese año;1;;Bilateral;Sin datos ese año;Sin datos ese año;ND;Sin datos ese año;Sin datos ese año;ND;MALÍ;AFRSUB;PMA;16061;207.510;207.510;Comunidades Autónomas;CCAA AND - Andalucía;CCAA AND AACI - Andalucía - Agencia Andaluza de Cooperación Internacional;07-BBB-02839;Sin datos ese año
2007;APOYO A LA REALIZACIÓN DE UN PROYECTO AUDIOVISUAL EN EL ÁREA MEDITERRÁNEA PARA LA SERIE DOCUMENTAL ACERCA DE LA GUERRA HISPANO-CUBANA DE 1898;APOYO A LA REALIZACIÓN DE UN PROYECTO AUDIOVISUAL EN EL ÁREA MEDITERRÁNEA PARA LA SERIE DOCUMENTAL ACERCA DE LA GUERRA HISPANO-CUBANA DE 1898;ND;39.083;Sin datos ese año;1;;Bilateral;Sin datos ese año;Sin datos ese año;ND;Sin datos ese año;Sin datos ese año;ND;CUBA;AMECEN;PRMB;16061;72.650;72.650;Comunidades Autónomas;CCAA AND - Andalucía;CCAA AND AACI - Andalucía - Agencia Andaluza de Cooperación Internacional;07-BBB-02840;Sin datos ese año
2007;APOYO AL PROGRAMA DE CREACIÓN DE UN CIRCUITO DE INTERCAMBIO CULTURAL AL ENTORNO DEL LIBRO CON EL MINISTERIO DE CULTURA DEL REINO DE MARRUECOS;APOYO AL PROGRAMA DE CREACIÓN DE UN CIRCUITO DE INTERCAMBIO CULTURAL AL ENTORNO DEL LIBRO CON EL MINISTERIO DE CULTURA DEL REINO DE MARRUECOS;ND;39.083;Sin datos ese año;1;;Bilateral;Sin datos ese año;Sin datos ese año;ND;Sin datos ese año;Sin datos ese año;ND;MARRUECOS;AFRNOR;PRMB;16061;283.830;283.830;Comunidades Autónomas;CCAA AND - Andalucía;CCAA AND AACI - Andalucía - Agencia Andaluza de Cooperación Internacional;07-BBB-02841;Sin datos ese año
2007;APOYO A LA REALIZACIÓN DE UN PROYECTO AUDIOVISUAL EN EL ÁREA MEDITERRÁNEA PARA LA SERIE DOCUMENTAL ACERCA DE LA GUERRA HISPANO CUBANA DE 1898;APOYO A LA REALIZACIÓN DE UN PROYECTO AUDIOVISUAL EN EL ÁREA MEDITERRÁNEA PARA LA SERIE DOCUMENTAL ACERCA DE LA GUERRA HISPANO CUBANA DE 1898;ND;39.083;Sin datos ese año;1;;Bilateral;Sin datos ese año;Sin datos ese año;ND;Sin datos ese año;Sin datos ese año;ND;CUBA;AMECEN;PRMB;16061;72.650;72.650;Comunidades Autónomas;CCAA AND - Andalucía;CCAA AND AACI - Andalucía - Agencia Andaluza de Cooperación Internacional;07-BBB-02855;Sin datos ese año
2007;FESTIVAL CINES DEL SUR;FESTIVAL CINES DEL SUR;ND;39.083;Sin datos ese año;1;;Bilateral;Sin datos ese año;Sin datos ese año;ND;Sin datos ese año;Sin datos ese año;ND;CUBA;AMECEN;PRMB;16061;200.000;200.000;Comunidades Autónomas;CCAA AND - Andalucía;CCAA AND AACI - Andalucía - Agencia Andaluza de Cooperación Internacional;07-BBB-02857;Sin datos ese año
2007;FORTALECIMIENTO DEL SISTEMA DE CASAS COMUNALES Y APOYO A PROYECTOS  CULTURALES COMUNITARIOS.;FORTALECIMIENTO DEL SISTEMA DE CASAS COMUNALES Y APOYO A PROYECTOS  CULTURALES COMUNITARIOS.;ND;39.083;Sin datos ese año;1;;Bilateral;Sin datos ese año;Sin datos ese año;ND;Sin datos ese año;Sin datos ese año;ND;CUBA;AMECEN;PRMB;16061;783.438;783.438;Comunidades Autónomas;CCAA AND - Andalucía;CCAA AND AACI - Andalucía - Agencia Andaluza de Cooperación Internacional;07-BBB-02876;Sin datos ese año
2007;PROGRAMA DE REHABILITACIÓN DE INFRAESTRUCTURAS CULTURALES RURALES.;PROGRAMA DE REHABILITACIÓN DE INFRAESTRUCTURAS CULTURALES RURALES.;ND;39.083;Sin datos ese año;1;;Bilateral;Sin datos ese año;Sin datos ese año;ND;Sin datos ese año;Sin datos ese año;ND;CUBA;AMECEN;PRMB;16061;775.917;775.917;Comunidades Autónomas;CCAA AND - Andalucía;CCAA AND AACI - Andalucía - Agencia Andaluza de Cooperación Internacional;07-BBB-02877;Sin datos ese año
2007;CONSTRUCCIÓN Y EQUIPAMIENTO DE LA NUEVA SEDE DEL CENTRO ANDALUZ DE LA HABANA.;CONSTRUCCIÓN Y EQUIPAMIENTO DE LA NUEVA SEDE DEL CENTRO ANDALUZ DE LA HABANA.;ND;39.083;Sin datos ese año;1;;Bilateral;Sin datos ese año;Sin datos ese año;ND;Sin datos ese año;Sin datos ese año;ND;CUBA;AMECEN;PRMB;16061;229.990;229.990;Comunidades Autónomas;CCAA AND - Andalucía;CCAA AND AACI - Andalucía - Agencia Andaluza de Cooperación Internacional;07-BBB-02878;Sin datos ese año
2007;CALLE DEL AGUA  ;CALLE DEL AGUA  ;ND;39.083;Sin datos ese año;1;;Bilateral;Sin datos ese año;Sin datos ese año;ND;Sin datos ese año;Sin datos ese año;ND;MARRUECOS;AFRNOR;PRMB;16061;196.832;196.832;Comunidades Autónomas;CCAA AND - Andalucía;CCAA AND AACI - Andalucía - Agencia Andaluza de Cooperación Internacional;07-BBB-02883;Sin datos ese año
2007;REFORZAMIENTO DE LAS CAPACIDADES EN NUEVAS TECNOLOGÍAS DE LA INFORMACIÓN Y LA COMUNICACIÓN DE LOS CUADROS SINDICALES DE LA CSTM ;REFORZAMIENTO DE LAS CAPACIDADES EN NUEVAS TECNOLOGÍAS DE LA INFORMACIÓN Y LA COMUNICACIÓN DE LOS CUADROS SINDICALES DE LA CSTM ;ND;39.083;Sin datos ese año;1;;Bilateral;Sin datos ese año;Sin datos ese año;ND;Sin datos ese año;Sin datos ese año;ND;MALÍ;AFRSUB;PMA;22040;34.140;34.140;Comunidades Autónomas;CCAA AND - Andalucía;CCAA AND AACI - Andalucía - Agencia Andaluza de Cooperación Internacional;07-BBB-02866;Sin datos ese año
2007;PROGRAMA PARA EL DESARROLLO DE LAS COMPETENCIAS DIRECTIVAS PARA MUJERES;PROGRAMA PARA EL DESARROLLO DE LAS COMPETENCIAS DIRECTIVAS PARA MUJERES;ND;39.083;Sin datos ese año;1;;Bilateral;Sin datos ese año;Sin datos ese año;ND;Sin datos ese año;Sin datos ese año;ND;AMÉRICA DEL NORTE, CENTRAL Y CARIBE, NO ESPECIFICADOS;AMECEN;NE;15164;150.000;150.000;Comunidades Autónomas;CCAA AND - Andalucía;CCAA AND AACI - Andalucía - Agencia Andaluza de Cooperación Internacional;07-BBB-02863;Sin datos ese año
2007;APOYO AL PROGRAMA NACIONAL DE VIOLENCIA DOMÉSTICA DEL INSTITUTO NACIONAL DE LA MUJER.;LA INTERVENCIÓN DESARROLLADA SE DIRIGE A FORTALECER LA APLICACIÓN POR PARTE DE LAS INSTITUCIONES PÚBLICAS DEL ESTADO HONDUREÑO DE LO ESTABLECIDO EN LA LEY CONTRA LA VIOLENCIA DOMÉSTICA, ESPECIALMENTE LO RELATIVO A MEJORAR LA CAPADIDAD INSTALADA DE LAS CAS;ND;39.083;Sin datos ese año;1;;Bilateral;Sin datos ese año;Sin datos ese año;ND;Sin datos ese año;Sin datos ese año;MEJORADA LA CAPACIDAD ACTUAL DE CASAS REFUGIO EXISTENTES EN HONDURAS A FIN DE BRINDAR PROTECCIÓN INMEDIATA A LAS MUJERES AFECTADAS POR VIOLENCIA DOMÉSTICA Y A SUS HIJOS E HIJAS DEPENDIENTES;HONDURAS;AMECEN;PRMB;15164;450.000;450.000;Comunidades Autónomas;CCAA AND - Andalucía;CCAA AND AACI - Andalucía - Agencia Andaluza de Cooperación Internacional;07-BBB-02891;Sin datos ese año
2007;FORTALECIMIENTO DE LAS CAPACIDADES Y LA AUTONOMÍA DE LAS MUJERES A TRAVÉS DE LA ALFABETIZACIÓN, LA FORMACIÓN PROFESIONAL Y EL EMPLEO;EL PROYECTO CONSISTE EN LA CONSTRUCCIÓN DE UN CENTRO DE ALFABETIZACIÓN Y FORMACIÓN PROFESINAL PARA MUJERES ADULTAS. EL CENTRO SUPONDRÁ UN RECURSO PERMANENTE PARA LAS MUJERES DE BAMAKO EN MATERIA DE EDUCACIÓN Y CAPACITACIÓN DE ADULTAS. PONDRÁ EN MARCHA LA ;BAMAKO;39.083;Sin datos ese año;1;;Bilateral;Sin datos ese año;Sin datos ese año;ND;Sin datos ese año;Sin datos ese año;EN FUNCIONAMIENTO UN CENTRO DE ALFABETIZACIÓN Y FORMACIÓN PROFESIONAL PARA MUJERES;MALÍ;AFRSUB;PMA;15164;267.152;267.152;Comunidades Autónomas;CCAA AND - Andalucía;CCAA AND AACI - Andalucía - Agencia Andaluza de Cooperación Internacional;07-BBB-02908;Sin datos ese año
2007;EMPODERANDO A LA MUJER EN PACHACUTEC;SE PRETENDE PROMOVER LA IGUALDAD DE GÉNERO Y EL EMPODERAMIENTO DE LA MUJER EN LA ZONA SUB URBANO MARGINAL DE LA CIUDAD DE PACHACUTEC. PARA ELLO SE PONDRÁ EN MARCHA EN EL CENTRO EDUCATIVO SAN JUAN MACÍAS UN PROGRAMA DE IGUALDAD DE OPORTUNIDADES PARA EL TRA;DISTRITO DE VENTANILLA( REGIÓN CALLAO) - SECTOR C DE AH. DE PACHACUTEC;39.083;Sin datos ese año;1;;Bilateral;Sin datos ese año;Sin datos ese año;ND;Sin datos ese año;Sin datos ese año;SE HABRÁ MEJORADO LA INFRAESTRUCTURA EDUCATIVA DEL CENTRO EDUCATIVO SAN JUAN MACÍAS, UBICADO EN EL SECTOR C DE LA CIUDADA PACHACUTEC;PERÚ;AMESUR;PRMB;15164;154.132;154.132;Comunidades Autónomas;CCAA AND - Andalucía;CCAA AND AACI - Andalucía - Agencia Andaluza de Cooperación Internacional;07-BBB-02935;Sin datos ese año
2007;"PROGRAMA ANDALUZ DE FORMACIÓN CONTINUA EN GÉNERO Y DESARROLLO: RED DE SENSIBILIZACIÓN Y SEGUIMIENTO-EVALUACIÓN SOBRE LA PERSPETIVA DE GÉNERO EN EL CUMPLIMIENTO DE LOS ODM"". FASE IV""";AMPLIACIÓN Y CONSOLIDACIÓN DE LA RED DESTINADA A LOS/AS AGENTES DE DESARROLLO DE LAS ONGDS, INSTITUCIONES ANDALUZAS Y A LOS/AS AGENTES EDUCATIVOS FORMALES SOBRE LA APLICACIÓN Y SEGUIMIENTO DE LA PERSPECTIVA DE GÉNERO EN EL DESARROLLO EN LE MARCO DE LOS OD;ALMERÍA, CÁDIZ, CÓRDOBA, GRANADA, HUELVA, JAÉN, MÁLAGA Y SEVILLA;39.083;Sin datos ese año;1;;Bilateral;Sin datos ese año;Sin datos ese año;ND;Sin datos ese año;Sin datos ese año;ND;PAÍSES EN VÍAS DE DESARROLLO, NO ESPECIFICADOS;PVD NE;NE;15164;68.648;68.648;Comunidades Autónomas;CCAA AND - Andalucía;CCAA AND AACI - Andalucía - Agencia Andaluza de Cooperación Internacional;07-BBB-03005;Sin datos ese año
2007;FAVORECER LA SENSIBILIZACIÓN Y EDUCACIÓN EN LA EQUIDAD DE GÉNERO Y EL DESARROLO DE 5.000 NIÑAS/OS, JÓVENES Y PERSONAS ADULTAS DE LA COMUNIDAD AUTÓNOMA DE ANDALUCÍA A LO LARGO DEL AÑO 2008.;FAVORECER LA SENSIBILIZACIÓN Y EDUCACIÓN EN LA EQUIDAD DE GÉNERO Y EL DESARROLO DE 5.000 NIÑAS/OS, JÓVENES Y PERSONAS ADULTAS DE LA COMUNIDAD AUTÓNOMA DE ANDALUCÍA A LO LARGO DEL AÑO 2008.;ND;39.083;Sin datos ese año;1;;Bilateral;Sin datos ese año;Sin datos ese año;ALUMNOS/AS 1RIA, 2RIA, PROFESORES, PADRES, TECNICOS/AS, PERIODISTAS, POBLACIÓN GRAL. - IND: VOLUNTAR;Sin datos ese año;Sin datos ese año;SE HABRÁ FAVORECIDO LA INCORPORACIÓN DEL ENFOQUE DE GÉNERO APLICADO AL DESARROLLO EN 20 CENTROS EDUCATIVOS DE PRIMARIA Y SECUNDARIA;PAÍSES EN VÍAS DE DESARROLLO, NO ESPECIFICADOS;PVD NE;NE;15164;50.015;50.015;Comunidades Autónomas;CCAA AND - Andalucía;CCAA AND AACI - Andalucía - Agencia Andaluza de Cooperación Internacional;07-BBB-03012;Sin datos ese año
2007;"""FORMANDO Y SENSIBILIZANDO EN GÉNERO Y DESARROLLO PARA LA LUCHA POR LAS METAS DE BEIJING""""""";PROMOVER EL CONOCIMIMIENTO Y EL COMPROMISO ENTRE DIFERENTES AGENTES DE LA SOCIEAD CIVIL ANDALUZA, ENTORNO A LA LUCHA POR LA IGUALDAD DE GÉNERO Y LA AUTONOMÍA DE LA MUJER DESDE EL RESPETO A LA DIVERSIDAD;"ALMERÍA:DALÍAS; CÁDIZ: UBRIQUE; CÓRDOBA: LUCENA; GRANADA: HUESCAR, PADÚL, MONACHIL; HUELVA: ARACENA; JAÉN; MÁLAGA: RONDA, JUBRIQUE; SEVILLA: EL CORONÍL";39.083;Sin datos ese año;1;;Bilateral;Sin datos ese año;Sin datos ese año;"DIR: CIUDADANÍA EN GRAL, JÓVENES ESTUDIANTES Y PROFESORES/AS; IND: NO CUANTIFICADO";Sin datos ese año;Sin datos ese año;"125 PERONAS VEN FORTALECIDAS SUS CAPACIDADES DE ORGANIZACIÓN EN PERSPECTIVA DE GÉNERO Y DESARROLLO EN VISTA DE HACER INCIDENCIA A FAVOR DEL OBJETIVO DEL MILENIO Nº 3: ""PROMOVER LA IGUALDAD DE GÉNERO Y EL EMPODERAMIENTO DE LA MUJER""""""";PAÍSES EN VÍAS DE DESARROLLO, NO ESPECIFICADOS;PVD NE;NE;15164;68.856;68.856;Comunidades Autónomas;CCAA AND - Andalucía;CCAA AND AACI - Andalucía - Agencia Andaluza de Cooperación Internacional;07-BBB-03023;Sin datos ese año
2007;PUESTA EN MARCHA DEL CENTRO MULTIFUNCIONAL DE LA MUJER EN TÁNGER, II FASE ;PUESTA EN MARCHA DEL CENTRO MULTIFUNCIONAL DE LA MUJER EN TÁNGER, II FASE ;TANGER;39.083;Sin datos ese año;1;;Bilateral;Sin datos ese año;Sin datos ese año;ND;Sin datos ese año;Sin datos ese año;ND;MARRUECOS;AFRNOR;PRMB;15164;946.560;946.560;Comunidades Autónomas;CCAA AND - Andalucía;CCAA AND AACI - Andalucía - Agencia Andaluza de Cooperación Internacional;07-BBB-02885;Sin datos ese año
2007;PROYECTO DE FORMACIÓN PARA MUJERES EN PRODUCCIÓN DE PLANTAS AROMÁTICAS;LA MEJORA DE LAS CONDICIONES DE VIDA DE LOS HABITANTES DE HMAMIOUICH PASA POR DOTARLES DE INFRAESTRUCTURAS NECESARIAS PARA LA VIDA DIARIA Y CAPACITARLES PARA EL MANTENIMIENTO DE SU ENTORNOY RECURSOS NATURALES, LA PRIMERA PARTE PRETENDE LA FORMACIÓN Y CAPA;TETUÁN - HMAMIOUICH;39.083;Sin datos ese año;1;;Bilateral;Sin datos ese año;Sin datos ese año;ND;Sin datos ese año;Sin datos ese año;REALIZADO UN INVENTARIO Y ESTUDIO CROMOGRÁFICO COMPLETO DE LAS PLANTAS AROMÁTICAS Y MEDICIONALES AUTÓCTONAS;MARRUECOS;AFRNOR;PRMB;15164;68.084;68.084;Comunidades Autónomas;CCAA AND - Andalucía;CCAA AND AACI - Andalucía - Agencia Andaluza de Cooperación Internacional;07-BBB-02936;Sin datos ese año
2007;PADEF - PROGRAMA DE AYUDA AL DESARROLLO DEL EMPRESARIADO FEMENINO;AUMENTAR LOS INGRESOS 21 COOPERATIVAS (227 MUJERES) Y DE 10 MUJERES EMPRESARIAS EN LA REGIÓN NORTE DE MARRUECOS;CHEFCHAOUEN, IFRANE, TETUÁN;39.083;Sin datos ese año;1;;Bilateral;Sin datos ese año;Sin datos ese año;MUJERES EMPRESARIAS;Sin datos ese año;Sin datos ese año;21 COOPERATIVAS HABRÁN REFORZADO SU CAPACIDAD DE GESTIÓN;MARRUECOS;AFRNOR;PRMB;15164;287.869;287.869;Comunidades Autónomas;CCAA AND - Andalucía;CCAA AND AACI - Andalucía - Agencia Andaluza de Cooperación Internacional;07-BBB-02981;Sin datos ese año
