año;título;descripción;localización;fecha inicio;fecha fin;duracion;tipo ayuda;vía canalización;odm;meta odm;tipo beneficiarios;numero beneficiarios;mujeres beneficiadas;resultado;región;área;renta;tema;importe comprometido;importe abonado;tipo organismo;organismo;agencia;número intervención;código interno
2007;FORTALECIMIENTO DE LAS ASOCIACIONES DEL SECTOR PRIVADO EN CENTROAMÉRICA;APOYO A LA IMPLANTACION DE ASOCIACIONES EMPRESARIALES CENTROAMERICANAS, Y A LA MEJORA DE SERVICIOS PRESTADOS A SUS ASOCIADOS;MUNICIPIOS DE PINER DEL RIO, HABANA VIEJA, HOLGUÍN, GUANTÁNAMO Y SANTIAGO DE CUBA;39.083;Sin datos ese año;1;;Bilateral;Sin datos ese año;Sin datos ese año;POBLACIÓN DE HOLGUIN Y PINAR DEL RIO;Sin datos ese año;Sin datos ese año;MEJORA DE LAS CAPACIDADES DE ARTICULACIÓN, IDENTIFICACI´N Y PLANEACIÓN TERRITORIALES;CUBA;AMECEN;PRMB;25010;399.500;199.500;Comunidades Autónomas;CCAA AND - Andalucía;CCAA AND AACI - Andalucía - Agencia Andaluza de Cooperación Internacional;07-BBB-03056;Sin datos ese año
2007;APOYO INSTITUCIONAL PARA LA EJECUCIÓN DEL PROGRAMA DE REHABILITACIÓN DE BASE COMUNITARIA EN EL NORTE DE MARRUECOS  ;APOYO INSTITUCIONAL PARA LA EJECUCIÓN DEL PROGRAMA DE REHABILITACIÓN DE BASE COMUNITARIA EN EL NORTE DE MARRUECOS  ;ND;39.083;Sin datos ese año;1;;Bilateral;Sin datos ese año;Sin datos ese año;ND;Sin datos ese año;Sin datos ese año;ND;MARRUECOS;AFRNOR;PRMB;15150;533.604;533.604;Comunidades Autónomas;CCAA AND - Andalucía;CCAA AND AACI - Andalucía - Agencia Andaluza de Cooperación Internacional;07-BBB-02886;Sin datos ese año
2007;APOYO INSTITUCIONAL PARA LA EJECUCIÓN DEL PROGRAMA DE REHABILITACIÓN DE BASE COMUNITARIA EN EL NORTE DE MARRUECOS  ;APOYO INSTITUCIONAL PARA LA EJECUCIÓN DEL PROGRAMA DE REHABILITACIÓN DE BASE COMUNITARIA EN EL NORTE DE MARRUECOS  ;ALHUCEMAS;39.083;Sin datos ese año;1;;Bilateral;Sin datos ese año;Sin datos ese año;ND;Sin datos ese año;Sin datos ese año;ND;MARRUECOS;AFRNOR;PRMB;15150;732.000;732.000;Comunidades Autónomas;CCAA AND - Andalucía;CCAA AND AACI - Andalucía - Agencia Andaluza de Cooperación Internacional;07-BBB-02887;Sin datos ese año
2007;FORTALECIMIENTO DE ASOCIACIONES Y COOPERATIVAS EN LA REGIÓN DE ALHUCEMAS, TAZA, TAOUNATE;EL PROYECTO RESPONDE A UNA ESTRATEGIA DE FORTALECIMIENTO DE ASOCIACIONES Y COOPERATIVAS A TRAVÉS DE LA CAPACITACIÓN DE LOS INTEGRANTES DE LAS ASOCIACIONES A TRAVES DE DOS NIVELES DE FORMACIÓN, UNO DIRIGIDO A FORMADORES Y OTRO A POBLACIÓN EN GENERAL. DIFUS;PROVINCIA DE ALHUCEMAS, TAZA, TAOUNATE - ALHUCEMAS, TAZA, TAOUNATE;39.083;Sin datos ese año;1;;Bilateral;Sin datos ese año;Sin datos ese año;ND;Sin datos ese año;Sin datos ese año;CAPACITADA Y FORTALECIDA LA CÉDULA DE SEGUIMIENTO DE PROYECTOS DE LA RED AL AMAL;MARRUECOS;AFRNOR;PRMB;15150;300.000;300.000;Comunidades Autónomas;CCAA AND - Andalucía;CCAA AND AACI - Andalucía - Agencia Andaluza de Cooperación Internacional;07-BBB-02920;Sin datos ese año
2007;DESARROLLO ASOCIATIVO Y ECONÓMICO DE DOMBE GRANDE;EL PROYECTO CONSISTE EN EL REFUERZO DE LAS ASOCIACIONES DE CAMPESINOS CON LA INTENCIÓN DE QUE EL PROCESO DESEMBOQUE EN LA CONSTITUCIÓN DE UNA COOPERATIVA DE CAMPESINOS. PARA GESTIONAR CON MEDIOS DE PRODUCCIÓN PROPIOS LA PREPARACIÓN DE LAS TIERRAS Y EL TRA;MUNICIPIO DE BAÍA FARTA, PROVINCIA DE BENGUELA - DOMBE GRANDE;39.083;Sin datos ese año;1;;Bilateral;Sin datos ese año;Sin datos ese año;ND;Sin datos ese año;Sin datos ese año;FORMADA UNA COOPERATIVA DE CAMPESINOS DE DOMBE GRANDE;ANGOLA;AFRSUB;PMA;15150;221.837;221.837;Comunidades Autónomas;CCAA AND - Andalucía;CCAA AND AACI - Andalucía - Agencia Andaluza de Cooperación Internacional;07-BBB-02921;Sin datos ese año
2007;FORTALECIMIENTO DE LA CONTRIBUCIÓN DE LA SOCIEDAD CUBANA DE ENFERMERÍA AL PROCESO DE DESARROLLO HUMANO;CON ESTE PROYECTO SE PRETENDE AMPLIAR LA COBERTURA DE LA INTERVENCIÓN A LA TOTALIDAD DE LAS PROVINCIAS DEL ÁMBITO NACIONAL, CONTINUANDO EL PROCESO DE FORTALECIMIENTO DE LOS PROCESOS DE GESTIÓN DEL NIVEL CENTRAL Y PERIFÉRICO DE LA SOUENF, SEGÚN UN ESQUEMA ;CUBA;39.083;Sin datos ese año;1;;Bilateral;Sin datos ese año;Sin datos ese año;ND;Sin datos ese año;Sin datos ese año;AMPLIACIÓN DE LA COBERTURA DE LA RED INFORMÁTICA DE LA COUENF CON ACCESO A INTERNET-INFOMED AL 100% DE LAS PROVINCIAS DEL ÁMBITO NACIONAL Y AL 100% DE LOS MUNICIPIOS DE LAS PROVINCIAS DE SANTIAGO DE CUBA, CAMAGÜEY Y VILLA CLARA;CUBA;AMECEN;PRMB;15150;299.993;299.993;Comunidades Autónomas;CCAA AND - Andalucía;CCAA AND AACI - Andalucía - Agencia Andaluza de Cooperación Internacional;07-BBB-02944;Sin datos ese año
2007;FORTALECIMIENTO DE LAS INSTITUCIONES LOCALES Y GRUPOS DE DESARROLLO PARA EL FOMENTO SOCIOECONÓMICO;INCREMENTAR LA CAPACIDAD DE LAS ORGANIZACIONES LOCALES PARA CONDUCIR LAS ESTRATEGIAS Y A LOS ACTORES SOCIALES HACIA LA CONSOLIDACIÓN DE SUS INSTITUCIONES, EL DESARROLLO Y LA EQUIDAD;MANABÍ;39.083;Sin datos ese año;1;;Bilateral;Sin datos ese año;Sin datos ese año;ND;Sin datos ese año;Sin datos ese año;SE HA FORTALECIDO LA AGENCIA DE DESARROLLO PROVINCIAL DE MANABÍ: CREACIÓN DE LA UNIDAD DE GESTIÓN DEL PROYECTO Y ASISTENCIA TÉCNICA Y ASESORAMIENTO A LA AGENCIA DE DESARROLLO PROVINCIAL DE MANABÍ;ECUADOR;AMESUR;PRMB;15150;300.000;300.000;Comunidades Autónomas;CCAA AND - Andalucía;CCAA AND AACI - Andalucía - Agencia Andaluza de Cooperación Internacional;07-BBB-02953;Sin datos ese año
2007;PROGRAMA DE DESARROLLO INTEGRAL DE LA JUVENTUD Y FORTALECIMIENTO DEL TEJIDO ASOCIATIVO DE LA COMUNIDAD GREGORIO LUPERÓN, SAN FRANCISCO DE MACORÍS;INSERCIÓN LABORAL DE LOS/AS JÓVENES DE LA COMUNIDAD GREGORIO LUPERÓN, EL AUMENTO DE SU INTEGRACIÓN Y PARTICIPACIÓN EN LA COMUNIDAD, Y UNA CONVIVENCIA FAMILIAR MÁS SANA Y ENRIQUECEDORA;PROVINCIA DUARTE - SAN FRANCISCO DE MACORIS;39.083;Sin datos ese año;1;;Bilateral;Sin datos ese año;Sin datos ese año;JÓVENES DE LA COMUNIDAD GREGORIO LUPERÓN;Sin datos ese año;Sin datos ese año;MEJORADA  LA CAPACITACIÓN PROFESIONAL Y LA INSERCIÓN LABORAL DE 50 JÓVENES DE ESCASOS RECURSOS.;DOMINICANA, REP.;AMECEN;PRMB;15150;133.973;133.973;Comunidades Autónomas;CCAA AND - Andalucía;CCAA AND AACI - Andalucía - Agencia Andaluza de Cooperación Internacional;07-BBB-02990;Sin datos ese año
2007;APOYO AL DESARROLLO HUMANO LOCAL EN CUBA;ACCIONES CONCRETAS, VINCUALDAS A LA EJECUCIÓN DE DE PROYECTOS DE DESARROLLO PRIORIZADOS Y A LA PROMOCIÓN Y FOMENTO DE LA COOPERACIÓN TÉCNICA, LA RELACIÓN ENTRE LAS CIUDADES Y LA VINCULACIÓN ENTRE LA COOPERACIÓN MULTILATERAL Y LA COOPERACIÓN DESCENTRALIZADA;ND;39.083;Sin datos ese año;1;;Bilateral;Sin datos ese año;Sin datos ese año;ND;Sin datos ese año;Sin datos ese año;ND;CUBA;AMECEN;PRMB;15150;40.000;40147;Comunidades Autónomas;CCAA AND - Andalucía;CCAA AND AACI - Andalucía - Agencia Andaluza de Cooperación Internacional;07-BBB-03057;Sin datos ese año
2007;FORMACIÓN DE LÍDERES SOCIALES PARA LA PROMOCIÓN Y DEFENSA DE LOS DERECHOS HUMANOS EN CANGALLO, AYACUCHO;EL PROYECTO BUSCA DISMINUIR LA VULNERABILIDAD DE LA POBLACIÓN CAMPESINA E INDÍGENA DE LA PROVINCIA DE CANGALLO CON ESPECIAL ATENCIÓN A LAS VÍCTIMAS DE LA VIOLENCIA POLÍTICA Y FAMILIAR. SE PRETENDE QUE LA POBLACIÓN CONOZCA SUS DERECHOS Y ESTÉ EN CAPACIDAD ;AYACUCHO, CANGALLO;39.083;Sin datos ese año;1;;Bilateral;Sin datos ese año;Sin datos ese año;ND;Sin datos ese año;Sin datos ese año;LÍDERES Y AUTORIDADES FORMADAS COMO LÍDERES SOCIALES ESTÁN CAPACITADOS, CONOCEN LOS DERECHOS HUMANOS Y ESTÁN EN CONDICIONES DE REALIZAR UN EFECTO MULITPLICADOR;PERÚ;AMESUR;PRMB;15162;206.534;206.534;Comunidades Autónomas;CCAA AND - Andalucía;CCAA AND AACI - Andalucía - Agencia Andaluza de Cooperación Internacional;07-BBB-02919;Sin datos ese año
2007;APLICACIÓN Y EXIGIBILIDAD DE DERECHOS DE LOS PUEBLOS INDÍGENAS DEL PERÚ, DESDE UN ENFOQUE DE GÉNERO. ÉTICA E INTERCULTURALIDAD;MEJORAR LAS CONDICIONES DE VIDA DE LA POBLACIÓN INDÍGENA AMAZÓNICA DEL PERÚ A TRAVÉS DE LA PROMOCIÓN DE LOS DERECHOS HUMANOS, PROMOVIENDO UNA DEMOCRACIA Y CIUDADANÍA INCLUSIVAS;SATIPO, RIOJA Y MOYABAMBA, CORONEL PORTILLO - REGIONES DE JUNIN, SAN MARTÍN Y UCAYALI;39.083;Sin datos ese año;1;;Bilateral;Sin datos ese año;Sin datos ese año;ND;Sin datos ese año;Sin datos ese año;FAVORECIDA LA INCORPORACIÓN DEL CONVENIO DE LA OIT EN EL ORDENAMIENTO JURÍDICO NACIONAL DEL PERÚ MEDIANTE EL ANÁLISIS Y SEGUIMIENTO DE LA INCORPORACIÓN DE LOS INSTRUMENTOS LEGALES;PERÚ;AMESUR;PRMB;15162;210.261;210.261;Comunidades Autónomas;CCAA AND - Andalucía;CCAA AND AACI - Andalucía - Agencia Andaluza de Cooperación Internacional;07-BBB-02946;Sin datos ese año
2007;PROYECTO DE FORMACIÓN DE FUNCIONARIOS MARROQUÍES EN MATERIA DE FONDOS EUROPEOS ;PROYECTO DE FORMACIÓN DE FUNCIONARIOS MARROQUÍES EN MATERIA DE FONDOS EUROPEOS ;ND;39.083;Sin datos ese año;1;;Bilateral;Sin datos ese año;Sin datos ese año;ND;Sin datos ese año;Sin datos ese año;seminario sobre programación de fondos europeos;MARRUECOS;AFRNOR;PRMB;15140;305.960;305.960;Comunidades Autónomas;CCAA AND - Andalucía;CCAA AND AACI - Andalucía - Agencia Andaluza de Cooperación Internacional;07-BBB-02842;Sin datos ese año
2007;PROGRAMA DE FORTALECIMIENTO DE LA CONVIVENCIA Y DESARROLLO INTEGRAL PARA LA CIUDADANÍA DE SAN SALVADOR.;"FUNDAMENTADOS EN LAS TRES PRIORIDADES DE TRABAJO D ELA ADMINISTRACIÓN MUNICIPAL 2006-2009, QUE SON: 1) MEJORAR LA CALIDAD Y COBERTURA DE LOS SERVICIOS MUNICIPALES; 2) RECUPERAR Y REVITALIZAR LOS ESPACIOS PÚBLICOS DE SAN SALVADOR PARA TODOS SUS HABITANTES,";ND;39.083;Sin datos ese año;1;;Bilateral;Sin datos ese año;Sin datos ese año;ND;Sin datos ese año;Sin datos ese año;CONSTRUIDOS Y EQUIPADOS 3 CENTROS DE FORTALECIMIENTO DE LA CONVIVENCIA Y DESARROLLO INTEGRAL PARA LA CIUDADANÍA DE SAN SALVADOR EN LOS DISTRITOS 1, 4 Y 6 DEL MUNICIPIO DE SAN SALVADOR, EN DONDE SE PROCURA EL USO IGUALITARIO Y SU APROPIACIÓN COLECTIVA;EL SALVADOR;AMECEN;PRMB;15140;1.600.000;1.600.000;Comunidades Autónomas;CCAA AND - Andalucía;CCAA AND AACI - Andalucía - Agencia Andaluza de Cooperación Internacional;07-BBB-02845;Sin datos ese año
2007;APOYO AL FORTALECIMIENTO DEL PAPEL DE LAS ENTIDADES LOCALES EN EL PROCESO DE INTEGRACIÓN CENTROAMERICANA.;LA INTERVENCIÓN SE DIRIGE A IMPULSAR EL PROCESO DE INTEGRACIÓN POLÍTICA CENTROAMERICANA INCORPORANDO, DESDE LO LOCAL, NUEVAS TEMÁTICAS Y ACTORES DE LA AGENDA REGIONAL, FACILITANDO LA INCLUSIÓN ACTIVA DE LOS GOBIERNOS LOCALES DE LOS DIVERSOS TERRITORIOS EN;ND;39.083;Sin datos ese año;1;;Bilateral;Sin datos ese año;Sin datos ese año;ND;Sin datos ese año;Sin datos ese año;ESTABLECIDO UN NUEVO ESPACIO DE DIÁLOGO, SINERGIAS Y COOPERACIÓN ENTRE LOS PODERES LOCALES CENTROAMERICANOS A TRAVÉS DEL FORO DE AUTORIDADES LOCALES DE CENTRO AMÉRICA EN PRO DE UNA VISIÓN REGIONAL DEL DESARROLLO EN CUALQUIERA DE SUS FACETAS;EL SALVADOR;AMECEN;PRMB;15140;150.000;150.000;Comunidades Autónomas;CCAA AND - Andalucía;CCAA AND AACI - Andalucía - Agencia Andaluza de Cooperación Internacional;07-BBB-02849;Sin datos ese año
2007;FORTALECIMIENTO ORGANIZATIVO DEL CONSEJO HONDUREÑO DEL SECTOR SOCIAL DE LA ECONOMÍA COHDESSE;FORTALECIMIENTO ORGANIZATIVO DEL CONSEJO HONDUREÑO DEL SECTOR SOCIAL DE LA ECONOMÍA COHDESSE;ND;39.083;Sin datos ese año;1;;Bilateral;Sin datos ese año;Sin datos ese año;ND;Sin datos ese año;Sin datos ese año;APOYADO Y DESARROLLADO EL PROCESO DE FORTALECIMIENTO DE LAS INSTANCIAS REGIONALES (CODESSES REGIONALES) DEL COHDESSE;HONDURAS;AMECEN;PRMB;15140;57.000;57.000;Comunidades Autónomas;CCAA AND - Andalucía;CCAA AND AACI - Andalucía - Agencia Andaluza de Cooperación Internacional;07-BBB-02859;Sin datos ese año
2007;DESARROLLO DE PROGRAMAS DE FORMACIÓN SOBRE DEFINICIÓN DE ROL DE LOS COHDESSE REGIONALES COMO GESTORES DE DESARROLLO Y LIDERAZGO;EN ESTA PROPUESTA LOS LINEAMIENTOS CONCEPTUALES QUE LA ACOMPAÑAN CONSIDERAN QUE EL CONTEXTO DE DESARTICULACIÇON SOCIAL Y EL INCREMENTO CONSTANTE DE LA POBREZA ASÍ COMO LA MARGINALIDAD SON PRODUCTO DE LA INSUFICIENCIA DINÁMICA DEL MERCADO CAPITALISTA Y DE ;ND;39.083;Sin datos ese año;1;;Bilateral;Sin datos ese año;Sin datos ese año;MIEMBROS DE LAS ASOCIACIONES DEL CONSEJO HONDUREÑO NACIONAL, QUE OCUPAN PUESTOS DE RESPONSA. REGIONA;Sin datos ese año;Sin datos ese año;ESTIMULADA LA PARTICIPACIÓN DE LOS ACTORES NE FORMA ASOCIATIVA, EN BASE A VALORES DE COOPERACIÓN Y SOLIDARIDAD;HONDURAS;AMECEN;PRMB;15140;87.500;87.500;Comunidades Autónomas;CCAA AND - Andalucía;CCAA AND AACI - Andalucía - Agencia Andaluza de Cooperación Internacional;07-BBB-02860;Sin datos ese año
2007;FORMACIÓN SINDICAL PARA EL REFORZAMIENTO ORGANIZATIVO DE LA UNION GÉNÉRALE DES TRAVAILLEURS ALGÉRIENS (UGTA) ;FORMACIÓN SINDICAL PARA EL REFORZAMIENTO ORGANIZATIVO DE LA UNION GÉNÉRALE DES TRAVAILLEURS ALGÉRIENS (UGTA) ;ND;39.083;Sin datos ese año;1;;Bilateral;Sin datos ese año;Sin datos ese año;ND;Sin datos ese año;Sin datos ese año;ND;ARGELIA;AFRNOR;PRMB;16020;63.202;63.202;Comunidades Autónomas;CCAA AND - Andalucía;CCAA AND AACI - Andalucía - Agencia Andaluza de Cooperación Internacional;07-BBB-02867;Sin datos ese año
2007;MEJORA DE LA PARTICIPACIÓN DE 500 HOMBRES Y MUJERES INTEGRANTES DE ORGANIZACIONES Y GOBIERNOS LOCALES EN LA GESTIÓN, ADMINISTRACIÓN Y PLANIFICACIÓN DEL DESARROLLO DE 25 COMUNIDADES DE HEBRÓN, TULKAREM, RAMALLAH Y GAZA;EL PROYECTO PRETENDE INCREMENTAR LA PARTICIPACIÓN CIUDADANA EN EL DIAGNÓSTICO DE LOS PROBLEMAS DE SUS COMUNIDADES Y CONTRIBUIR A MEJORAR LA GESTIÓN DE LOS GOBIERNOS LOCALES. SE FORMARÁ A 500 INTEGRANTES DE ORGANIZACIONES COMUNITARIAS DE BASE PALESTINAS (O;HEBRÓN, TULKAREM, RAMALAH, GAZA;39.083;Sin datos ese año;1;;Bilateral;Sin datos ese año;Sin datos ese año;ND;Sin datos ese año;Sin datos ese año;AL 12º MES DE EJECUCIÓN DEL PROYECTO SE HABRÁ CAPACITADO A 500 INTEGRANTES DE LAS ORGANIZACIONES LOCALES PALESTINAS DE 25 COMUNIDADES PALESTINAS DE HEBRÓN, TULKAREM, RAMALLAH Y GAZA A TRAVÉS DE 5 CURSOS DE DESCENTRALIZACIÓN ADMINISTRATIVA, 4 CURSOS DE TÉ;PALESTINOS, TERRITORIOS;OMEDIO;PRMB;15140;299.336;299.336;Comunidades Autónomas;CCAA AND - Andalucía;CCAA AND AACI - Andalucía - Agencia Andaluza de Cooperación Internacional;07-BBB-02918;Sin datos ese año
2007;MEJORA DE LAS OPORTUNIDADES LOCALES DE AUTOEMPLEO E INSERCIÓN LABORAL, E INCREMENTO DE LA CAPACIDAD PRODUCTIVA Y EMPRESARIAL DE 300 FAMILIAS DE LOS BARRIOS DE BELLA FLOR Y SAN JOSÉ DE LOS SAUCES, CIUDAD DE BOLÍVAR, BOGOTÁ;"EL PROYECTO FOMENTA LA REACTIVACIÓN DE LOS TEJIDOS ECONÓMICOS Y PRODUCTIVO EN LOS BARRIOS DE BELLA FLOR Y SAN JOSÉ DE LOS SAUCES, SE ARTICULA A TRAVÉS DE LOS SIGUIENTES COMPONENTES: CAPACITACIÓN PARA EL EMPLEO Y EL AUTOEMPLEO; PRODUCTIVO Y EMPRESARIAL; IN";CUNDINAMARCA - CIUDAD BOLÍVAR;39.083;Sin datos ese año;1;;Bilateral;Sin datos ese año;Sin datos ese año;ND;Sin datos ese año;Sin datos ese año;FORTALECIDA LA RED DE PRESTACIÓN DE SERVICIOS DE ATENCIÓN SOCIAL, CON LA CREACIÓN DE UNA ESCUELA COMUNITARIA EN PRÁCTICA QUE CONTRIBUYE A LA FORMACIÓN EN SERVICIOS Y HABILIDADES SOCIALES, COMO PUERTA DE ACCESO DE AMBAS COMUNIDADES AL EMPLEO FORMAL, A LA A;COLOMBIA;AMESUR;PRMB;16020;296.323;296.323;Comunidades Autónomas;CCAA AND - Andalucía;CCAA AND AACI - Andalucía - Agencia Andaluza de Cooperación Internacional;07-BBB-02932;Sin datos ese año
2007;MEJORA DE LA GESTIÓN ENERGÉTICA EN CENTROS PÚBLICOS EN EL NORTE DE MARRUECOS ;MEJORA DE LA GESTIÓN ENERGÉTICA EN CENTROS PÚBLICOS EN EL NORTE DE MARRUECOS ;TAZA-ALHUCEMAS Y TÁNGER-TETUÁN;39.083;Sin datos ese año;1;;Bilateral;Sin datos ese año;Sin datos ese año;ND;Sin datos ese año;Sin datos ese año;3 centros de carácter social (2 hospitales, 1 Matadero) equipados con sistemas solares térmicos;MARRUECOS;AFRNOR;PRMB;23010;280.264;280.264;Comunidades Autónomas;CCAA AND - Andalucía;CCAA AND AACI - Andalucía - Agencia Andaluza de Cooperación Internacional;07-BBB-02834;Sin datos ese año
2007;FORTALECIMIENTO DE LA AGRICULTURA URBANA EN LOS MUNICIPIOS DE JAGÜEY GRANDE, PEDRO BETANCOURT Y CIÉNAGA DE ZAPATA.;FORTALECIMIENTO DE LA AGRICULTURA URBANA EN LOS MUNICIPIOS DE JAGÜEY GRANDE, PEDRO BETANCOURT Y CIÉNAGA DE ZAPATA.;ND;39.083;Sin datos ese año;1;;Bilateral;Sin datos ese año;Sin datos ese año;ND;Sin datos ese año;Sin datos ese año;ND;CUBA;AMECEN;PRMB;31161;867.095;867.095;Comunidades Autónomas;CCAA AND - Andalucía;CCAA AND AACI - Andalucía - Agencia Andaluza de Cooperación Internacional;07-BBB-02875;Sin datos ese año
2007;DESARROLLO DE LA GANADERÍA CAPRINA Y MEJORA DE LAS CONDICIONES SOCIALES DE FAMILIAS GANADERAS;EL PROYECTO SE PLANTEA COMO UN REFUERZO AL PROCESO DE FORTALECIMIENTO Y REVALORIZACIÓN DE LOS RECUROS LOCALES EN EL VALLE DEL RÍO OUED LAOU. SE PRETENDE DESARROLLAR Y MEJORAR LAS EXPECTATIVAS SOCIOECONÓMICAS DEL GANADO CAPRINO EN LA ZONA. SE PRETENDE PALI;CHEFCHAOUEN Y TETOUAN, DOUARES DEL VALLE DEL RÍO OUED LAOU;39.083;Sin datos ese año;1;;Bilateral;Sin datos ese año;Sin datos ese año;ND;Sin datos ese año;Sin datos ese año;SE HAN IMPLEMENTADO TODOS LOS MEDIOS TÉCNICOS NECESARIOS PARA IMPLEMENTAR LA MEJORA Y EL CONTROL DEL GANADO CAPRINO;MARRUECOS;AFRNOR;PRMB;31163;236.025;236.025;Comunidades Autónomas;CCAA AND - Andalucía;CCAA AND AACI - Andalucía - Agencia Andaluza de Cooperación Internacional;07-BBB-02909;Sin datos ese año
2007;APOYO A LA RECUPERACIÓN PRODUCTIVA INTEGRAL DE LA ACTIVIDAD GANADERA DE TRE COOPERATIVAS EN LA PROVINCIA DE MATANZAS;EL PROYECTO TRABAJARÁ CON TRES UNIDADES DE PRODUCCIÓN COOPERATIVA (UBPC) QUE ES UNA DE LAS FORMAS DE PRODUCCIÓN AGROPECUARIA EXISTENTE EN CUBA. LAS TRES UNIDADES SON LA UBPC CUMBRE ALTA, LA UBPC RAMÓN PAZ Y LA UBPC FE DEL VALLE. SE PRETENDE GARANTIZAR UN ;MATANZAS, MARTÍ Y LOS ARABOS;39.083;Sin datos ese año;1;;Bilateral;Sin datos ese año;Sin datos ese año;ND;Sin datos ese año;Sin datos ese año;SE HABRÁ DISEÑADO UN PROCESO INTEGRAL DE MANEJO Y PRODUCCIÓN DE LOS DISTINTOS REBAÑOS, IMPLEMENTANDO UN PROCESO DE PLANIFICACIÓN ESTRATÉGICA Y ESTBLECIDO UN SISTEMA DE MONITOREO DE IMPACTO;CUBA;AMECEN;PRMB;31163;248.809;248.809;Comunidades Autónomas;CCAA AND - Andalucía;CCAA AND AACI - Andalucía - Agencia Andaluza de Cooperación Internacional;07-BBB-02913;Sin datos ese año
2007;AUMENTO Y MEJORA DE LA CAPACIDAD SOCIO-PRODUCTIVA Y ORGANIZATIVA DE LA UNIÓN DE MACHAVA, EN EL BARRIO DE MACHAVA DE LA CIUDAD DE MAPUTO;LA INTERVENCIÓN DE DESARROLLO PROPUESTA PRETENDE INCIDIR EN EL AUMENTO DE LA CAPACIDAD PRODUCTIVA DE LAS COOPERATIVAS AGRÍCOLAS DE MUJERES. UN SISTEMA DE BOMBEO PARA REGADÍO Y CONSTRUCCIÓN DE UN CERCADO DE PROTECCIÓN QUE MINIMICE LAS SIGNIFICATIVAS PÉRDID;MAPUTO, DISTRITO: MACHAVA;39.083;Sin datos ese año;1;;Bilateral;Sin datos ese año;Sin datos ese año;ND;Sin datos ese año;Sin datos ese año;"LAS COOPERATIVAS AGROPECUARIAS ""16 DE JUNHO 1"""", """"16 DE JUNHO 2"""", """" MADJEDJE 1"""", """"MADJEDJE 2"""", """"MADJEDJE 3"""", """"1º DE MAIO"""", """"OPERAçAO PRODUçAO"""" Y """"3 DE VEVEREIRO"""" CUENTAN CON UN SISTEMA DE RIEGO EN FUNCIONAMIENTO PARA EL DESARROLLO DE SU ACTIVIDAD AGRÍCOLA""";MOZAMBIQUE;AFRSUB;PMA;31161;299.983;299.983;Comunidades Autónomas;CCAA AND - Andalucía;CCAA AND AACI - Andalucía - Agencia Andaluza de Cooperación Internacional;07-BBB-02915;Sin datos ese año
2007;CONTRIBUCIÓN AL LOGRO DE LA SOBERANÍA ALIMENTARIA POR PARTE DE LA POBLACIÓN CAMPESINA DEL DISTRITO DE MARRACUENE EN LA PROVINCIA DE MAPUTO;LA PRESENTE INTERVENCIÓN PRETENDE MEJORAR LAS CONDICIONES DE VIDA DE 4.224 FAMILIAS CAMPESINAS DEL DISTRITO DE MARRACUENE QUE ESTÁN ORGANIZADAS EN 31 ASOCIACIONES Y 7 COOPERATIVAS FORMANDO LA UCAM (UNIAO DE COOPERATIVAS AGRÍCOLAS DE MARRACUENE. LAS LÍNEAS;MAPUTO-DISTRITO DE MARRACUENE;39.083;Sin datos ese año;1;;Bilateral;Sin datos ese año;Sin datos ese año;ND;Sin datos ese año;Sin datos ese año;MEJORADA Y AUMENTADA LA CAPACIDAD PRODUCTUVA DE 38 ASOCIACIONES Y COOPERATIVAS DE MIEMBROS DE LA UCAM Y DE SU SEDE EN MARRACUENE;MOZAMBIQUE;AFRSUB;PMA;31161;233.677;233.677;Comunidades Autónomas;CCAA AND - Andalucía;CCAA AND AACI - Andalucía - Agencia Andaluza de Cooperación Internacional;07-BBB-02916;Sin datos ese año
2007;MEJORA DE LAS CONDICIONES PARA ASEGURAR LA SOBERANÍA ALIMENTARIA EN EL DEPARTAMENTO DE MATAGALPA;"CON EL PROYECTO SE PRETENDE MEJORAR LAS CONDICIONES PARA ASEGURAR LA SOBERANÍA ALIMENTARIA EN EL DEPARTAMENTO DE MATAGALPA, A TRAVÉS DE LA EDUCACIÓN EN INCIDENCIA POLÍTICA DE LÍDERES CAMPESINOS/AS Y LA IMPLEMENTACIÓN DEL ""PROGRAMA CAMPESINO A CAMPESINO"""" E""";MATAGALPA;39.083;Sin datos ese año;1;;Bilateral;Sin datos ese año;Sin datos ese año;ND;Sin datos ese año;Sin datos ese año;FORMADOS Y CAPACITADOS 180 LÍDERES CAMPESINOS/AS DE LA UNAG EN LAS POLÍTICAS PÚBLICAS MUNICIPALES Y NACIONALES EN EL DEPARTAMENTO DE MATAGALPA;NICARAGUA;AMECEN;PRB;31161;252.641;252.641;Comunidades Autónomas;CCAA AND - Andalucía;CCAA AND AACI - Andalucía - Agencia Andaluza de Cooperación Internacional;07-BBB-02917;Sin datos ese año
2007;DESARROLLO SOCIOECONÓMICO DE LAS FAMILIAS ALTOANDINAS EN BASE A LA CADENA PRODUCTIVA DE FIBRA DE ALPACA EN LAS PROVINCIAS DE HUANCAVELICA Y ANGARAES;DESARROLLO SOCIOECONÓMICO DE LAS FAMILIAS ALTOANDINAS EN BASE A LA CADENA PRODUCTIVA DE FIBRA DE ALPACA EN LAS PROVINCIAS DE HUANCAVELICA Y ANGARAES;PROVINCIAS DE HUANCAVELICA Y ANGARAES - DEPARTAMENTO DE HUANCAVELICA - 12 COMUNIDADES DE LOS DISTRITOS DE LIRCAY, CCOCHACCASA Y YAULI;39.083;Sin datos ese año;1;;Bilateral;Sin datos ese año;Sin datos ese año;ND;Sin datos ese año;Sin datos ese año;SE HA MEJORADO LOS SISTEMAS DE CRIANZA Y PRODUCCIÓN, PROMOVIENDO EL MANEJO TÉCNICO DEL CALENDARIO ALPAQUERO COMO SOPORTE A LA CADENA PRODUCTIVA DE PRODUCCIÓN;PERÚ;AMESUR;PRMB;31163;300.000;300.000;Comunidades Autónomas;CCAA AND - Andalucía;CCAA AND AACI - Andalucía - Agencia Andaluza de Cooperación Internacional;07-BBB-02945;Sin datos ese año
2007;SEGURIDAD ALIMENTARIA Y DESARROLLO AGRUPECUARIO EN LOS DISTRITOS DE TURPO, TALVAVERA DE LA REINA Y SANTA MARÍA DE CHICMO, APURIMAC;MEJORA DE LA COMERCIALIZACIÓN DE PRODUCTOS LÁCTEOS Y MEJORA DE LOS ÍNDICES NUTRICIONALES EN NIÑOS MENORES DE TRES AÑOS EN LAS COMUNIDADES DE LUIS PATA, OSCOLLOPAMPA, CCACCACHA, MULACANCHA (DISTRITO DE TALAVERA DE LA REINA), TAYPICHA, YANACCMA, CONTUCNA (D;PROVINCIA DE ANDAHUYLAS, REGIÓN APURIMAC - DISTRITOS DE TURPO, TALAVERA Y CHICMO;39.083;Sin datos ese año;1;;Bilateral;Sin datos ese año;Sin datos ese año;ND;Sin datos ese año;Sin datos ese año;360 FAMILIAS DE LOS DISTRITOS DE TURPO Y TALAVERA DE LA REINA HAN DESARROLLADO CAPACIDADES PARA PREVENIR SITUACIONES DE RIESGO EN LA SALUD DE LOS NIÑOS MENORES DE 3 AÑOS Y GESTANTES;PERÚ;AMESUR;PRMB;31161;299.869;299.869;Comunidades Autónomas;CCAA AND - Andalucía;CCAA AND AACI - Andalucía - Agencia Andaluza de Cooperación Internacional;07-BBB-02955;Sin datos ese año
2007;FORTALECIMIENTO DE CAPACIDADES PARA LA DEFENSA DE LA SOBERANÍA ALIMENTARIA EN EL SECTOR CAFETALERO DE LA REGIÓN SUR;CONTRIBUCIÓN A LA MEJORA DE LA CALIDAD DE VIDA DE LAS FAMILIAS CAFICULTORAS EN LOS NÚCLEOS DE SAN CRISTÓBAL, LA ASOCIACIÓN LA ESPERANZA (ASOCAES), BANÍ, SAN JOSÉ DE OCOA Y AZUA, A TRAVÉS DEL FORTALECIMIENTO DE SUS CAPACIDADES PARA LA PRODUCCIÓN SOSTENIBLE;SAN CRISTÓBAL;39.083;Sin datos ese año;1;;Bilateral;Sin datos ese año;Sin datos ese año;ND;Sin datos ese año;Sin datos ese año;INCREMENTO EN UN 25% DEL CAFÉ ACOPIADO Y DE UN 50% DE LA CALIDAD DEL MISMO EN LOS NÚCLEOS DE BANÍ, AZUA, SAN CRISTÓBAL, ASOCAES Y SAN JOSÉ DE OCOA AL DISPONER DE LAS INFRAESTRUCTURAS ADECUADAS PARA EL PROCESAMIENTO DEL CAFÉ;DOMINICANA, REP.;AMECEN;PRMB;31161;274.457;274.457;Comunidades Autónomas;CCAA AND - Andalucía;CCAA AND AACI - Andalucía - Agencia Andaluza de Cooperación Internacional;07-BBB-02959;Sin datos ese año
2007;PRODUCCIÓN Y COMERCIALIZACIÓN DE PRODUCTOS Y PLANTACIÓN AGROFORESTAL PARA LA GENERACIÓN DE INGRESOS;PROMOVER INICIATIVAS PARA EL AUMENTO DE INGRESOS FAMILIARES PARA LAS FAMILIAS AFECTADAS DIRECTAMENTE POR EL CONFLICTO ARMADO INTERNO;CHIMALTENANGO - MUNICIPIO DE SAN JOSÉ POAQUIL, HACIENDA MARÍA;39.083;Sin datos ese año;1;;Bilateral;Sin datos ese año;Sin datos ese año;COMUNIDADES RURALES;Sin datos ese año;Sin datos ese año;FINALIZADO EL PROYECTO LOS AGRICULTORES CUENTAN CON SEMILLAS PARA CULTIVAR PLANTAS AGROFORESTALES;GUATEMALA;AMECEN;PRMB;31161;161.085;161.085;Comunidades Autónomas;CCAA AND - Andalucía;CCAA AND AACI - Andalucía - Agencia Andaluza de Cooperación Internacional;07-BBB-02979;Sin datos ese año
2007;DESARROLLO AGROPECUARIO ALTERNATIVO Y GESTIÓN DEL AGUA DE RIEGO EN LA CUENCA BAJA DEL JEQUETEPEQUE;PRODUCTORES, HOMBRES Y MUJERES, DE LA PARTE BAJA DE LA CUENCA DEL RÍO JEQUETEPEQUE, A TRAVÉS DE LA DIVERSIFICACIÓN DE LA PRODUCCIÓN AGROPECUARIA, CRIANZAS DE ANIMALES MENORES Y EL INCREMENTO DE INGRESOS DE MANERA;LA LIBERTAD - VALLE JEQUETEPEQUE;39.083;Sin datos ese año;1;;Bilateral;Sin datos ese año;Sin datos ese año;PRODUCTORES AGRARIOS;Sin datos ese año;Sin datos ese año;PEQUEÑOS PRODUCTORES/AS CON CAPACIDADES TÉCNICAS Y EMPRESARIALES PARA MANEJO DE CULTIVOS ALTERNATIVOS Y CRIANZAS DE ANIMALES MENORES;PERÚ;AMESUR;PRMB;31163;299.670;299.670;Comunidades Autónomas;CCAA AND - Andalucía;CCAA AND AACI - Andalucía - Agencia Andaluza de Cooperación Internacional;07-BBB-02997;Sin datos ese año
